challenge_id,category,subcategory,duration_days,difficulty,title_en,description_en,title_ar,description_ar,title_fr,description_fr
challenge-tongue-flattery-03,tongue,false_praise,14,hard,14-Day Praise Cleanse,"For 14 days, be mindful of any praise you offer. Let it be genuine and spiritually safe.",تطهير المدح لمدة 14 يوماً,لمدة أسبوعين، طهر مدحك من المجاملات الفارغة.,Nettoyage d'éloge de 14 jours,"Pendant deux semaines, purifiez vos éloges des compliments vides."
challenge-tongue-secrets-01,tongue,exposing_secrets,1,easy,Zip the Lips,Do not reveal anything personal you know about others for 24 hours. Not even hints.,اقفل شفتيك,اليوم، التزم الصمت عندما تشعر بالرغبة في قول شيء سلبي.,Fermez les lèvres,"Aujourd'hui, restez silencieux quand vous ressentez l'envie de dire quelque chose de négatif."
challenge-tongue-secrets-02,tongue,exposing_secrets,7,medium,Safeguard the Trust,"For 7 days, reflect on whether you speak from trust. Record slips and ask Allah for restraint.",احفظ الأمانة,اليوم، احفظ كل أمانة وسر أوكل إليك.,Protégez la confiance,"Aujourd'hui, protégez chaque confiance et secret qui vous est confié."
challenge-tongue-secrets-03,tongue,exposing_secrets,3,medium,Honour the Private,"If you've recently shared something private, contact that person to affirm your trust.",أكرم الخاص,اليوم، احترم خصوصية الآخرين ولا تفشِ أسرارهم.,Honorez le privé,"Aujourd'hui, respectez la vie privée des autres et ne révélez pas leurs secrets."
challenge-tongue-vulgar-01,tongue,vulgarity,1,easy,Refined Language Day,"No swearing, rough words, or aggressive tone for 24 hours. Use words of mercy and dignity.",يوم اللغة المهذبة,اليوم، استخدم لغة مهذبة ونظيفة في كل محادثاتك.,Jour de langage raffiné,"Aujourd'hui, utilisez un langage raffiné et propre dans toutes vos conversations."
challenge-tongue-vulgar-02,tongue,vulgarity,7,medium,Speak Like a Believer – 7 Days,"For a full week, monitor your speech tone and purity. Use reminders and daily du'a for control.",تكلم كالمؤمن - 7 أيام,لمدة 7 أيام، اجعل كلامك يليق بالمؤمن.,Parlez comme un croyant - 7 jours,"Pendant 7 jours, faites que votre discours convienne à un croyant."
challenge-tongue-vulgar-03,tongue,vulgarity,14,hard,14-Day Clean Speech Reset,"Avoid all profanity, innuendo, or hostile tone for 14 days. Let your words carry the fragrance of mercy.",إعادة تعيين الكلام النظيف لمدة 14 يوماً,لمدة أسبوعين، اعيد تعيين لغتك إلى الكلام النظيف والطاهر.,Réinitialisation du discours propre de 14 jours,"Pendant deux semaines, réinitialisez votre langage vers un discours propre et pur."
challenge-tongue-arguing-01,tongue,arguing,1,easy,Let It Go (Once),Walk away from one argument today — even if you're right. Choose peace over ego.,اتركها (مرة واحدة),اليوم، اترك شيئاً واحداً كان يؤذيك واعف عنه.,Laissez tomber (une fois),"Aujourd'hui, laissez tomber une chose qui vous blessait et pardonnez-la."
challenge-tongue-arguing-02,tongue,arguing,7,medium,7 Days of Calm Speech,Refrain from raising your voice or arguing for 7 days. Choose stillness over combativeness.,7 أيام من الكلام الهادئ,لمدة أسبوع، تكلم بهدوء وتجنب الجدال.,7 jours de parole calme,"Pendant une semaine, parlez calmement et évitez les disputes."
challenge-tongue-arguing-03,tongue,arguing,14,hard,14-Day Dispute Detox,"Avoid all disputes — verbal, online, or passive-aggressive — for 14 days. Replace with du'a.",تخلص من الجدال لمدة 14 يوماً,لمدة أسبوعين، تجنب الجدال والمناقشات العقيمة.,Détox de dispute de 14 jours,"Pendant deux semaines, évitez les disputes et les discussions stériles."
challenge-zina-flirt-01,zina,flirtatious_speech,1,easy,Guard Your Words,"Today, avoid flirtatious or suggestive language in all conversations — online or in person.",احرس كلماتك,اليوم، تجنب اللغة المغازلة أو الموحية في جميع المحادثات — على الإنترنت أو وجهاً لوجه.,Gardez vos mots,"Aujourd'hui, évitez le langage flirteur ou suggestif dans toutes les conversations — en ligne ou en personne."
challenge-zina-flirt-02,zina,flirtatious_speech,3,medium,3-Day Speech Purity,Speak respectfully and modestly for 3 days. Avoid playful messaging that crosses limits.,طهارة الكلام لمدة 3 أيام,تحدث باحترام وتواضع لمدة 3 أيام. تجنب الرسائل المرحة التي تتجاوز الحدود.,Pureté de parole de 3 jours,Parlez respectueusement et modestement pendant 3 jours. Évitez les messages ludiques qui dépassent les limites.
challenge-zina-flirt-03,zina,flirtatious_speech,7,medium,7-Day Messaging Cleanse,Avoid texting or speaking with romantic intent to anyone outside of marriage for 7 days.,تطهير الرسائل لمدة 7 أيام,لمدة أسبوع، طهر رسائلك من كل ما يثير الفتنة.,Nettoyage de messagerie de 7 jours,"Pendant une semaine, purifiez vos messages de tout ce qui éveille la tentation."
challenge-zina-privacy-01,zina,private_contact,1,easy,Respect Personal Boundaries,Do not place yourself in a one-on-one private setting with a non-mahram today.,احترم الحدود الشخصية,لا تضع نفسك في إطار خاص وجهاً لوجه مع غير محرم اليوم.,Respectez les limites personnelles,Ne vous placez pas dans un cadre privé en tête-à-tête avec un non-mahram aujourd'hui.
challenge-zina-privacy-02,zina,private_contact,3,medium,3-Day Halwa Barrier,"Avoid all private, unsupervised contact with the opposite gender for 3 days.",حاجز الخلوة لمدة 3 أيام,لمدة 3 أيام، تجنب الخلوة مع الأجانب.,Barrière d'intimité de 3 jours,"Pendant 3 jours, évitez l'intimité avec les étrangers."
challenge-zina-privacy-03,zina,private_contact,7,medium,7 Days of Honour,Protect your dignity and that of others by avoiding any risky proximity for 7 days.,7 أيام من الشرف,لمدة أسبوع، احتفظ بشرفك وتجنب المواقف المشبوهة.,7 jours d'honneur,"Pendant une semaine, préservez votre honneur et évitez les situations suspectes."
challenge-zina-media-01,zina,romantic_media,1,easy,Skip the Scene,"Today, fast-forward or avoid any sexualised scene in shows, music, or books.",تجاهل المشهد,اليوم، تسريع أو تجنب أي مشهد جنسي في البرامج أو الموسيقى أو الكتب.,Ignorez la scène,"Aujourd'hui, avancez rapidement ou évitez toute scène sexualisée dans les émissions, la musique ou les livres."
challenge-zina-media-02,zina,romantic_media,3,medium,3-Day Content Reset,"Avoid all romantic or sensual entertainment — music, video, novels — for 3 days.",إعادة تعيين المحتوى لمدة 3 أيام,لمدة 3 أيام، اعيد تعيين المحتوى الذي تستهلكه إلى الحلال.,Réinitialisation du contenu de 3 jours,"Pendant 3 jours, réinitialisez le contenu que vous consommez vers le halal."
challenge-zina-media-03,zina,romantic_media,7,medium,7-Day Desire Detox,"Cleanse your media intake. Focus on modest, inspiring content only for 7 days.",تخلص من الرغبة لمدة 7 أيام,لمدة أسبوع، تخلص من المحتوى الذي يثير الرغبات المحرمة.,Détox de désir de 7 jours,"Pendant une semaine, éliminez le contenu qui éveille les désirs interdits."
challenge-zina-fantasy-01,zina,fantasising,1,easy,Shift the Thought,"Today, when a lustful thought arises, immediately make dhikr or say a du'a of protection.",غير الفكرة,اليوم، كلما جاءتك فكرة سيئة، غيرها إلى فكرة طيبة.,Changez la pensée,"Aujourd'hui, chaque fois qu'une mauvaise pensée vous vient, changez-la en une bonne pensée."
challenge-zina-fantasy-02,zina,fantasising,3,medium,3-Day Mind Rewire,Actively replace indecent thoughts with thoughts of Jannah or death for 3 days.,إعادة توصيل العقل لمدة 3 أيام,لمدة 3 أيام، اعيد توصيل أفكارك نحو الطهارة.,Reconnexion mentale de 3 jours,"Pendant 3 jours, reconnectez vos pensées vers la pureté."
challenge-zina-fantasy-03,zina,fantasising,7,medium,7 Days of Thought Control,Guard your inner gaze. Monitor your thoughts and redirect temptations all week.,7 أيام من السيطرة على الأفكار,لمدة أسبوع، تحكم في أفكارك وتجنب الخيالات المحرمة.,7 jours de contrôle des pensées,"Pendant une semaine, contrôlez vos pensées et évitez les fantasmes interdits."
challenge-zina-social-01,zina,social_media,1,easy,Unfollow Temptation,"Today, unfollow any account that tempts you toward lust or comparison.",إلغاء متابعة الإغراء,اليوم، ألغ متابعة حساب أو مصدر يثير فيك الرغبات المحرمة.,Arrêtez de suivre la tentation,"Aujourd'hui, arrêtez de suivre un compte ou une source qui éveille en vous des désirs interdits."
challenge-zina-social-02,zina,social_media,3,medium,3-Day Scroll Purity,"For the next 3 days, limit screen time and avoid apps that encourage visual temptation.",طهارة التصفح لمدة 3 أيام,لمدة 3 أيام، تصفح وسائل التواصل بطهارة.,Pureté de défilement de 3 jours,"Pendant 3 jours, naviguez sur les réseaux sociaux avec pureté."
challenge-zina-social-03,zina,social_media,7,medium,7-Day Social Reset,Detox your digital space. Only allow feeds that remind you of modesty and sincerity.,إعادة تعيين وسائل التواصل لمدة 7 أيام,لمدة أسبوع، اعيد تعيين استخدامك لوسائل التواصل.,Réinitialisation sociale de 7 jours,"Pendant une semaine, réinitialisez votre utilisation des réseaux sociaux."
challenge-zina-companionship-01,zina,unlawful_relationship,1,easy,Cut the Thread,Mute or archive one chat that you know leads you to sin. Give yourself space today.,اقطع الخيط,اليوم، اقطع التواصل مع شخص يجرك إلى المعصية.,Coupez le fil,"Aujourd'hui, coupez la communication avec quelqu'un qui vous entraîne vers le péché."
challenge-zina-companionship-02,zina,unlawful_relationship,3,medium,3-Day Boundaries,Avoid replying or initiating flirtatious contact with any non-mahram for 3 days.,حدود لمدة 3 أيام,لمدة 3 أيام، ضع حدوداً واضحة في علاقاتك.,Limites de 3 jours,"Pendant 3 jours, établissez des limites claires dans vos relations."
challenge-zina-companionship-03,zina,unlawful_relationship,7,medium,7-Day Exit Strategy,Begin planning to end any illicit relationship. Make istighfar and write your intention.,استراتيجية الخروج لمدة 7 أيام,لمدة أسبوع، ضع استراتيجية للخروج من العلاقات المحرمة.,Stratégie de sortie de 7 jours,"Pendant une semaine, développez une stratégie pour sortir des relations interdites."
challenge-zina-hopelessness-01,zina,hopelessness,1,easy,Du'a of Hope,Read or listen to the du'a of Yunus (as) today. Reflect on its power to lift shame.,دعاء الأمل,اليوم، ادع دعاء الأمل والتوبة من القلب.,Du'a d'espoir,"Aujourd'hui, faites une du'a d'espoir et de repentir du cœur."
challenge-zina-hopelessness-02,zina,hopelessness,3,medium,3-Day Mercy Reminder,Repeat daily: 'Allah's mercy is greater than my sin.' Make sincere du'a each day.,تذكرة الرحمة لمدة 3 أيام,لمدة 3 أيام، تذكر رحمة الله وأنه يقبل التوبة.,Rappel de miséricorde de 3 jours,"Pendant 3 jours, rappelez-vous la miséricorde d'Allah et qu'Il accepte le repentir."
challenge-zina-hopelessness-03,zina,hopelessness,7,medium,7 Days of Returning,"For 7 days, pray 2 rak'at of tawbah and write one reflection on healing and hope.",7 أيام من العودة,لمدة أسبوع، عد إلى الله بالتوبة والاستغفار.,7 jours de retour,"Pendant une semaine, revenez à Allah avec repentir et demande de pardon."